idx,state,county,muni,all_text,section_count,source
41,Illinois,Will County,MANHATTAN,"CHAPTER 4ZONING DISTRICTS AND MAPSECTION:4-4-1: Districts Established4-4-2: Zoning Map4-4-3: District Boundaries4-4-4: Entire Area Zoned4-4-5: Annexed Territory4-4-6: Commercial And Industrial Table Of Permitted And Special Uses 
4-4-1: DISTRICTS ESTABLISHED:The village, for the purpose of this title, is hereby divided into the following zoning districts: A. Agricultural districts: A-1 Agricultural district CR Conservation/recreation district B. Residential districts: ER Estate residential district GR General residential district R-1 Single-family residence district R-2 Multi-family residence district R-3 Multi-family residence district R-4 Two-family residence district R-5 Multiple-family residence district R-6 Residential apartment district C. Commercial districts: C-1 Local shopping district C-2 Community shopping district C-3 General commercial district CBD Central business district BP Business park district DD Downtown district D. Industrial districts: I-1 Office, research and light industrial district I-2 Light industrial district I-3 Heavy industrial district E. Overlay districts: Manhattan lowland conservancy overlay district. (Ord., 4-7-1970; amd. Ord. 587, 6-1-1993; Ord. 591, 11-16-1993; Ord. 633, 9-17-1996; Ord. 634, 9-17-1996; Ord. 642, 12-3-1996; Ord. 700, 7-6-1999; Ord. 1083, 7-19-2011; Ord. 1112, 6-19-2012)\n""} 
4-4-2: ZONING MAP: A. Authorization: The location and boundaries of the districts established by this title are indicated upon the map entitled, \""official zoning map, village of Manhattan, Illinois\"", which, together with all explanatory matter thereon, is hereby adopted by reference and declared to be a part of this title. B. Location Of Map: The official zoning map shall be located in the office of the village clerk and shall be the final authority as to the current zoning status of land and buildings, subject to such authorized amendments which may be in effect. (Ord., 4-7-1970)\n""} 
4-4-3: DISTRICT BOUNDARIES: A. Interpretation Of District Boundaries: Where uncertainty exists as to the boundaries of districts as shown on the official zoning map, the following rules shall apply: 1. Boundaries indicated as approximately following the centerlines of streets, highways, or alleys shall be construed to follow such centerlines. 2. Boundaries indicated as approximately following village limits shall be construed as following village limits. 3. Boundaries indicated as following railroad lines shall be construed to be midway between the main tracks. 4. Boundaries indicated as approximately following the centerlines of streams shall be construed to follow such centerlines. 5. Boundaries indicated as parallel to or extensions of features indicated in subsections A1 through A4 of this section shall be so construed. Distances not specifically indicated on the official zoning map shall be determined by dimensions shown on the map, or in the absence of dimensions, by the scale of the map. 6. All streets, alleys, public ways, and railroad rights of way, if not otherwise specifically designated, shall be deemed to be in the same zone as the property immediately abutting upon such alleys, streets, public ways and railroad rights of way. The centerline of a street, alley, public way or railroad right of way, unless otherwise specifically designated, shall be deemed to be the district boundary. 7. Streets or alleys which are shown on the map and which have heretofore been vacated, or which are vacated hereafter, shall be in the same district as the land abutting both sides of the street or alley. If the land abutting each side of the street or alley was located in different districts before the street or alley was vacated, the centerline of the vacated street or alley shall be the district boundary. 8. Where physical or cultural features existing on the ground are at variance with those shown on the official zoning map, or in other circumstances not covered by subsections A1 through A5 of this section, the zoning board of appeals shall interpret the district boundaries. B. Changes: If, by amendment to this title, any change is made in any district boundary or in any other matter shown on the official zoning map, such change shall be indicated on the map promptly after the amendment is adopted. The date of the latest updating of the official zoning map shall be shown on the face of the map. (Ord., 4-7-1970)\n""} 
4-4-4: ENTIRE AREA ZONED:It is the intent that the entire area of zoning jurisdiction, including all land and water areas, rivers, streets, alleys, and railroad and other rights of way, be included in the districts established by this title. If any area is not shown on the official zoning map as being included in any district, it shall be deemed to be in the R-1 single-family residence district. (Ord., 4-7-1970)\n""} 
4-4-5: ANNEXED TERRITORY:Any territory hereafter annexed shall, upon annexation, be automatically classified in the ER estate residential district, until such territory is reclassified in a manner provided by law. If within ninety (90) days after annexation, no application for reclassification of the property has been filed, the plan commission shall on its own motion schedule a public hearing on the advisability of the zoning classification of the property and thereafter, if needed, make recommendations for the reclassification of the property. This section shall not apply to territory annexed with a valid preannexation agreement adopted pursuant to 65 Illinois Compiled Statutes 5/11-15.1-1 et seq. (Ord. 645, 6-3-1997)\n""} 
4-4-6: COMMERCIAL AND INDUSTRIAL TABLE OF PERMITTED AND SPECIAL USES: S = Special use requiredP = Permitted useBlank cell = ProhibitedUseC-1C-2C-3CBDBPI-1I-2I-3UseC-1C-2C-3CBDBPI-1I-2I-3Retail businesses: Adult-use cannabis dispensing organization S SSS Amusement establishments including, but not limited to, batting cages, bowling alleys, pool halls, dance halls, miniature golf, skating rinks, video arcades and banquet facilities SPPPPP Amusement parks, including, but not limited to, permanent carnivals, kiddie parks and other similar outdoor amusements S SPP Apparel storePPPPP Automobile service stations, repair facilities and car washes when used in conjunction with the automobile service station SP PPP Automobile, truck and recreational vehicle sales and rental PSPPPP Automobile, truck and recreational vehicle service PP Bakeries manufacturing products for off site sales as a primary use SPPP Bakery, in which the manufacture of goods is limited to goods retailed on the premises onlyPPPPP Bars, taverns and package liquor storesSSPPP Bicycle sales, rental and repair stores PPPP Boat showrooms, sales and repairs P PPP Book and stationery storePPPPP Building contractor's office and material storage; provided, however, that all equipment and vehicles are stored or parked indoors or adequately screened from view of the right of way S P Building material and products, sales, storage and accessory manufacturing of building components S S PP Camera storePPPPP Candy and confectionery storePPPPP Catering establishments, including pizza delivery PPPP Clothing and shoe stores, costume rental and sales PPPP Convenience store not associated with automobile fuel salesSSPSP Dairy products storePPPPP DelicatessenPPPPP Department, discount and general retail stores PPPP Drive-through as an accessory use SSSS DrugstorePPPPP Dry goods storePPPPP Electric appliance stores including radio and television sales and repair PPPP Electrical showrooms and shops P P Farm equipment sales and service S PP Farm implement, feed and seed stores P P Firearm range, indoor S SSS Firearm range, outdoor SS Firearm sales and service, including off premises FFL sales S SSS Floral shopPPPPP Furniture stores, including upholstering when conducted as part of the retail operation and secondary to the principal use PPPP Greenhouses, nurseries, garden supply, tool and seed stores PPPP Grocery and food storePPPPP Hardware storePPPPP Household appliance stores, sales, service and rental PPPP Ice cream storePPPPP Interior decorating shops, including upholstering and making of draperies, slipcovers, and other similar articles, when conducted as a part of the retail operation and secondary to the principal use PPPP Jewelry storePPPPP Lumberyards PSP PP Meat marketPPPPP Medical cannabis dispensary S SSS Musical instrument sales and repair PPPP Office supply stores PPPP Pawnshops SSS Pet stores and animal grooming shops PPPP Plumbing and heating service and equipment stores P P Restaurants, drive-inSPPPPSS Restaurants, excluding drive- in or drive-through servicePPPPPSS Restaurants which include drive-through facilities S SSS Restaurants with alcohol brewing as an accessory use SSS Shoe storePPPPP Showrooms and retail outlets PP Sporting goods storePPPPP Theaters, indoor PPPP Theaters, outdoor and drive-in S S Tire stores, sales and service P P PP Tobacco and/or vape store SP S Tobacco, for use on site as a primary or accessory use SSS Toy storePPPPP Variety storePPPPP Wireless communications sales and servicePPPPP Personal service establishments: BarbershopPPPPP Beauty parlorPPPPP Body piercing and/or tattooing establishments SSSS Car washes SS S SS Clubs, lodges and meeting halls PPPPSS Dancing school or studioPPPPP Daycare centersSPP S Daycare centers and early childhood learning facilities S Day spa/massage establishments S SSS Dry cleaner, but not a central plant serving more than 1 retail outletPPPPP Funeral homes, mortuaries, cemeteries and mausoleums PPPP Garages for repair and servicing of motor vehicles, including body repair, painting and engine rebuilding P P Hotels and motels SPPPP Laundry and dry cleaner, self- service onlyPPPPP Music schoolPPPPP Photographic studioPPPPP Printing and publishing and duplicating establishments PPPP Recreational centers and facilities, health and fitness centers and athletic clubs PPPP S Schools for business, professional or technical training, music or dance PPPP PP Self-storage warehouse establishments S S PP Shoe repair shopPPPPP Tailor shopPPPPP Taxidermists P P Union halls, hiring halls and trade association offices/meeting rooms PPP PP Warehouse and storage facilities SSS Business service establishments: Bank, not including drive-in facilitiesPPPPPPPP Banks and financial institutions with drive-through facilitiesSSSSSSSS Cash for gold business SSS Currency exchange PPPPP Financial institutionPPPPP Insurance agencyPPPPP Loan companyPPPPP Real estate officePPPPP Savings and loan, not including drive-in facilitiesPPPPP Title/payday loan store SSS Professional office establishments: Animal hospitals SP P Attorney and law officesPPPPPPPP Chiropractor's officePPPPPPPP Dentist's officePPPPPPPP Doctor's, surgeon's and/or physician's officesPPPPPPPP Medical and dental clinics, licensedPPPPPPPP Newspaper offices PPPPPP Office building, generalPPPPPPPP Optician's officePPPPPPPP Osteopath's officePPPPPPPP Private clinicPPPPPPPPPublic, quasi-public and governmental buildings and facilities: Airports, heliports and landing strips PP Bus and train stations SSS ChurchPPPPP Convention centers S PPP Essential services: gas regulator stations, telephone exchanges and/or electric substationSSSSSSSS Filtration plant, pumping station, well and water reservoirSSSSSPSS Golf courses and other open space and recreational uses typically allowed in the conservation recreation zoning district PP Governmental and public utility uses on lots having areas, widths, yards and other conditions as approved by the village boardSSSSSSSS Hospitals PPP Microwave relay towerSSSSSSSS Museums and art galleries PPPP Off street parking facility as an accessory usePPPPPPPP Parking lots and parking structures as a principal use PPPPPP Post officePPPPP Power plants SP Radio and television stations and recording studios PPPP Sewage treatment plant SSS Stadiums and arenas S SSS Training and educational facilities P Industrial: Adult-use cannabis craft grower S SSS Adult-use cannabis cultivation center SSSS Adult-use cannabis infuser organization S SSS Adult-use cannabis processing organization SSS Adult-use cannabis transporting organization SSS Cartage and express facilities S S PP Electronic industries PPPP Experimental product development PPPP Foundries, forges and smelters S Industrial design firms PPPP Junkyards, salvage yards and automobile graveyards SS Laboratories, excluding any outdoor testing of animal, plant or other biological and genetic research PPPP Light assembly operations PPPP Light industrial, assembly and laboratory facilities, as such uses relate to the production of products and parts; excluding, however, uses that require EPA or NPDES approval PPPP Light industrial, assembly and laboratory facilities, as such uses relate to the production of products and parts that require EPA or NPDES approval SPPP Machine shops PP Manufacturing activities, including electronic and scientific precision instruments manufacture and light machinery production and assembly, but excluding those uses which may be obnoxious or pose a nuisance for any reason including emission of toxic or hazardous substances, odor, noise, dust, smoke or gas PPPP Manufacturing, compounding, processing and storage of flammable liquids, gasses, chemicals, acids, fertilizers S Manufacturing, heavy, which includes the fabricating, assembly, disassembly, processing or treatment of goods and products, including, but not limited to: asphalt products; concrete and cement products; construction equipment; motor vehicles; and paints, inks P Manufacturing, light, which includes the fabricating, assembly, disassembly, processing or treatment of goods and products, including, but not limited to: appliances; books, printed materials; bottling companies; clothing and textiles; drugs; electrical components; food processing, food manufacture; furniture, bedding, and carpet manufacture; glass and ceramics; paper and paper products; plastic and fiberglass; sheet metal; tools; and wood assembly and finishing PP Medical cannabis cultivation center SS Mining operations S Motor and rail freight terminals PP Newspaper and magazine publishing PP Outdoor storage, as a principal use, except junkyards, salvage yards, and wrecked vehicle storage yards PP Petroleum production, refining and storage S Pharmaceutical industries PPPP Pilot plants in which processes planned for use in production elsewhere can be treated to the extent reasonably necessary for full investigation of the merits of a product or process including commercial viability PPPP Production of prototype products when limited to the scale reasonably necessary for full investigation of the merits of a product, including commercial viability PPPP Railroad yard, including switching, storage, loading, unloading and maintenance facilities, except those considered accessory to a permitted use, which shall be considered as a permitted use SP Recycling centers SP Sanitary landfills, solid waste transfer stations, composting, energy reclamation facilities, incinerators, and similar uses, but excluding hazardous or radioactive waste disposal SS Steel mills S Synthetic natural gas plants S Technology and research centers, including medical and hospital research establishments PPPP Warehousing and distribution facilities PP Warehousing and distribution facilities, but excluding motor freight terminals PPP Welding PP Wholesale establishments, storage, warehousing and distribution centers (excluding \""motor freight terminals\"", defined as \""a building or area in which trucks, including tractor trailer units are parked, stored or serviced, including the transfer, loading or unloading of goods. A terminal may include facilities for the temporary storage of loads prior to transport\"") in conjunction with an office use or wholesale establishment. The storage of fuel oil shall be prohibited, unless incidental to the on site operation PPPP Woodworking PPOther: Buildings whose height exceeds the maximum building height in the I-1 district S Buildings whose height exceeds the maximum building height in the I-2 district S Comprehensive sign planSSSSSSSS Dwelling units when located above the ground floor only when utilized as a mixed use in conjunction with a commercial usePPPP Dwelling units when located on the ground floor only when utilized as a mixed use in conjunction with a commercial useSSSS Planned unit developments (in accordance with the applicable regulations of chapter 9 of this title)SSSSSSSS Residence (1 only) of the proprietor, caretaker, or watchman, when located on the premises SSS Uses whose lot area is less than the minimum lot area required in the I-3 district S Other uses which are of the same general character as the above permitted uses or special uses, as determined by the zoning administratorSSSSSSSS (Ord. 1235, 9-20-2016; amd. Ord. 1307-09, 11-19-2019; Ord. 1334-20, 10-6- 2020)\n""} S = Special use required P = Permitted use Blank cell = Prohibited Use C-1 C-2 C-3 CBD BP I-1 I-2 I-3 Use C-1 C-2 C-3 CBD BP I-1 I-2 I-3 Retail businesses: Adult-use cannabis dispensing organization S S S S Amusement establishments including, but not limited to, batting cages, bowling alleys, pool halls, dance halls, miniature golf, skating rinks, video arcades and banquet facilities S P P P P P Amusement parks, including, but not limited to, permanent carnivals, kiddie parks and other similar outdoor amusements S S P P Apparel store P P P P P Automobile service stations, repair facilities and car washes when used in conjunction with the automobile service station S P P P P Automobile, truck and recreational vehicle sales and rental P S P P P P Automobile, truck and recreational vehicle service P P Bakeries manufacturing products for off site sales as a primary use S P P P Bakery, in which the manufacture of goods is limited to goods retailed on the premises only P P P P P Bars, taverns and package liquor stores S S P P P Bicycle sales, rental and repair stores P P P P Boat showrooms, sales and repairs P P P P Book and stationery store P P P P P Building contractor's office and material storage; provided, however, that all equipment and vehicles are stored or parked indoors or adequately screened from view of the right of way S P Building material and products, sales, storage and accessory manufacturing of building components S S P P Camera store P P P P P Candy and confectionery store P P P P P Catering establishments, including pizza delivery P P P P Clothing and shoe stores, costume rental and sales P P P P Convenience store not associated with automobile fuel sales S S P S P Dairy products store P P P P P Delicatessen P P P P P Department, discount and general retail stores P P P P Drive-through as an accessory use S S S S Drugstore P P P P P Dry goods store P P P P P Electric appliance stores including radio and television sales and repair P P P P Electrical showrooms and shops P P Farm equipment sales and service S P P Farm implement, feed and seed stores P P Firearm range, indoor S S S S Firearm range, outdoor S S Firearm sales and service, including off premises FFL sales S S S S Floral shop P P P P P Furniture stores, including upholstering when conducted as part of the retail operation and secondary to the principal use P P P P Greenhouses, nurseries, garden supply, tool and seed stores P P P P Grocery and food store P P P P P Hardware store P P P P P Household appliance stores, sales, service and rental P P P P Ice cream store P P P P P Interior decorating shops, including upholstering and making of draperies, slipcovers, and other similar articles, when conducted as a part of the retail operation and secondary to the principal use P P P P Jewelry store P P P P P Lumberyards P S P P P Meat market P P P P P Medical cannabis dispensary S S S S Musical instrument sales and repair P P P P Office supply stores P P P P Pawnshops S S S Pet stores and animal grooming shops P P P P Plumbing and heating service and equipment stores P P Restaurants, drive-in S P P P P S S Restaurants, excluding drive- in or drive-through service P P P P P S S Restaurants which include drive-through facilities S S S S Restaurants with alcohol brewing as an accessory use S S S Shoe store P P P P P Showrooms and retail outlets P P Sporting goods store P P P P P Theaters, indoor P P P P Theaters, outdoor and drive-in S S Tire stores, sales and service P P P P Tobacco and/or vape store S P S Tobacco, for use on site as a primary or accessory use S S S Toy store P P P P P Variety store P P P P P Wireless communications sales and service P P P P P Personal service establishments: Barbershop P P P P P Beauty parlor P P P P P Body piercing and/or tattooing establishments S S S S Car washes S S S S S Clubs, lodges and meeting halls P P P P S S Dancing school or studio P P P P P Daycare centers S P P S Daycare centers and early childhood learning facilities S Day spa/massage establishments S S S S Dry cleaner, but not a central plant serving more than 1 retail outlet P P P P P Funeral homes, mortuaries, cemeteries and mausoleums P P P P Garages for repair and servicing of motor vehicles, including body repair, painting and engine rebuilding P P Hotels and motels S P P P P Laundry and dry cleaner, self- service only P P P P P Music school P P P P P Photographic studio P P P P P Printing and publishing and duplicating establishments P P P P Recreational centers and facilities, health and fitness centers and athletic clubs P P P P S Schools for business, professional or technical training, music or dance P P P P P P Self-storage warehouse establishments S S P P Shoe repair shop P P P P P Tailor shop P P P P P Taxidermists P P Union halls, hiring halls and trade association offices/meeting rooms P P P P P Warehouse and storage facilities S S S Business service establishments: Bank, not including drive-in facilities P P P P P P P P Banks and financial institutions with drive-through facilities S S S S S S S S Cash for gold business S S S Currency exchange P P P P P Financial institution P P P P P Insurance agency P P P P P Loan company P P P P P Real estate office P P P P P Savings and loan, not including drive-in facilities P P P P P Title/payday loan store S S S Professional office establishments: Animal hospitals S P P Attorney and law offices P P P P P P P P Chiropractor's office P P P P P P P P Dentist's office P P P P P P P P Doctor's, surgeon's and/or physician's offices P P P P P P P P Medical and dental clinics, licensed P P P P P P P P Newspaper offices P P P P P P Office building, general P P P P P P P P Optician's office P P P P P P P P Osteopath's office P P P P P P P P Private clinic P P P P P P P P Public, quasi-public and governmental buildings and facilities: Airports, heliports and landing strips P P Bus and train stations S S S Church P P P P P Convention centers S P P P Essential services: gas regulator stations, telephone exchanges and/or electric substation S S S S S S S S Filtration plant, pumping station, well and water reservoir S S S S S P S S Golf courses and other open space and recreational uses typically allowed in the conservation recreation zoning district P P Governmental and public utility uses on lots having areas, widths, yards and other conditions as approved by the village board S S S S S S S S Hospitals P P P Microwave relay tower S S S S S S S S Museums and art galleries P P P P Off street parking facility as an accessory use P P P P P P P P Parking lots and parking structures as a principal use P P P P P P Post office P P P P P Power plants S P Radio and television stations and recording studios P P P P Sewage treatment plant S S S Stadiums and arenas S S S S Training and educational facilities P Industrial: Adult-use cannabis craft grower S S S S Adult-use cannabis cultivation center S S S S Adult-use cannabis infuser organization S S S S Adult-use cannabis processing organization S S S Adult-use cannabis transporting organization S S S Cartage and express facilities S S P P Electronic industries P P P P Experimental product development P P P P Foundries, forges and smelters S Industrial design firms P P P P Junkyards, salvage yards and automobile graveyards S S Laboratories, excluding any outdoor testing of animal, plant or other biological and genetic research P P P P Light assembly operations P P P P Light industrial, assembly and laboratory facilities, as such uses relate to the production of products and parts; excluding, however, uses that require EPA or NPDES approval P P P P Light industrial, assembly and laboratory facilities, as such uses relate to the production of products and parts that require EPA or NPDES approval S P P P Machine shops P P Manufacturing activities, including electronic and scientific precision instruments manufacture and light machinery production and assembly, but excluding those uses which may be obnoxious or pose a nuisance for any reason including emission of toxic or hazardous substances, odor, noise, dust, smoke or gas P P P P Manufacturing, compounding, processing and storage of flammable liquids, gasses, chemicals, acids, fertilizers S Manufacturing, heavy, which includes the fabricating, assembly, disassembly, processing or treatment of goods and products, including, but not limited to: asphalt products; concrete and cement products; construction equipment; motor vehicles; and paints, inks P Manufacturing, light, which includes the fabricating, assembly, disassembly, processing or treatment of goods and products, including, but not limited to: appliances; books, printed materials; bottling companies; clothing and textiles; drugs; electrical components; food processing, food manufacture; furniture, bedding, and carpet manufacture; glass and ceramics; paper and paper products; plastic and fiberglass; sheet metal; tools; and wood assembly and finishing P P Medical cannabis cultivation center S S Mining operations S Motor and rail freight terminals P P Newspaper and magazine publishing P P Outdoor storage, as a principal use, except junkyards, salvage yards, and wrecked vehicle storage yards P P Petroleum production, refining and storage S Pharmaceutical industries P P P P Pilot plants in which processes planned for use in production elsewhere can be treated to the extent reasonably necessary for full investigation of the merits of a product or process including commercial viability P P P P Production of prototype products when limited to the scale reasonably necessary for full investigation of the merits of a product, including commercial viability P P P P Railroad yard, including switching, storage, loading, unloading and maintenance facilities, except those considered accessory to a permitted use, which shall be considered as a permitted use S P Recycling centers S P Sanitary landfills, solid waste transfer stations, composting, energy reclamation facilities, incinerators, and similar uses, but excluding hazardous or radioactive waste disposal S S Steel mills S Synthetic natural gas plants S Technology and research centers, including medical and hospital research establishments P P P P Warehousing and distribution facilities P P Warehousing and distribution facilities, but excluding motor freight terminals P P P Welding P P Wholesale establishments, storage, warehousing and distribution centers (excluding \""motor freight terminals\"", defined as \""a building or area in which trucks, including tractor trailer units are parked, stored or serviced, including the transfer, loading or unloading of goods. A terminal may include facilities for the temporary storage of loads prior to transport\"") in conjunction with an office use or wholesale establishment. The storage of fuel oil shall be prohibited, unless incidental to the on site operation P P P P Woodworking P P Other: Buildings whose height exceeds the maximum building height in the I-1 district S Buildings whose height exceeds the maximum building height in the I-2 district S Comprehensive sign plan S S S S S S S S Dwelling units when located above the ground floor only when utilized as a mixed use in conjunction with a commercial use P P P P Dwelling units when located on the ground floor only when utilized as a mixed use in conjunction with a commercial use S S S S Planned unit developments (in accordance with the applicable regulations of chapter 9 of this title) S S S S S S S S Residence (1 only) of the proprietor, caretaker, or watchman, when located on the premises S S S Uses whose lot area is less than the minimum lot area required in the I-3 district S Other uses which are of the same general character as the above permitted uses or special uses, as determined by the zoning administrator S S S S S S S S",7,codelibrary
