idx,state,county,muni,all_text,section_count,source
3,California,Contra Costa County,DANVILLE,ShareDownloadBookmarkPrintARTICLE VZONING MAP; DISTRICTS ESTABLISHED,1,codelibrary
6,California,Los Angeles County,TEMPLE CITY,"ShareDownloadBookmarkPrint9-1B-1: ESTABLISHMENT OF ZONES: A. General: The city is divided into various zones to allow for orderly, planned development and to implement the General Plan. Table 9-1B-1 identifies all zones. All zones will be listed and appropriately designated on the official Zoning Map.B. Base Zone: Every parcel must have a base zone that establishes the primary type and intensity of land use permitted along with development regulations for that type and intensity of land use. C. Special Use Zone: A special use (or overlay) zone supplements the base zone for the purpose of establishing special uses or development regulations for an area in addition to the provisions of the underlying base zone. In the event a conflict arises between the base zone regulations and the overlay zone regulations, the provisions of the overlay zone will apply.Table 9-1B-1Zones Implementing the General Plan Zoning Map Symbol Zone Description Corresponding General Plan Land Use Designation Table 9-1B-1Zones Implementing the General Plan Zoning Map Symbol Zone Description Corresponding General Plan Land Use Designation Residential Zones R-1Low-Density Residential Low-Density Residential (RL) R-2Medium-Density Residential Medium-Density Residential (RM)R-3High-Density Residential High-Density Residential (RH)Commercial ZonesNCNeighborhood Commercial Commercial (C) DCDowntown Commercial Commercial (C)LTCLas Tunas Commercial Commercial (C)Mixed Use ZonesMU-LMixed-Use LowMixed-Use (MU) MU-MMixed-Use MediumMixed-Use (MU)Manufacturing ZoneIIndustrialIndustrial (IL)Institutional and Open Space ZoneI/OSInstitutional and Open SpaceInstitutional (I), Parks (P), Open Space (OS) Special Use ZonesPDPlanned Development All Residential designations, Commercial, Industrial, Institutional, Mixed-Use, Mixed-Use - Specific Plan (Ord. 19-1036)",1,codelibrary
22,Florida,Broward County,COOPER CITY,"Chapter 23ZONING DISTRICTS**Editor's note Unified Land Development Regulations adopted via Ordinance 97-5-3, 1, 5-27-97. Art. I. Zoning Districts and Map Art. II. Use Regulations Art. III. Dimensional Standards Art. IV. District Regulations Art. V. Supplementary Regulations Art. VI. Administration and Procedures
ARTICLE I. ZONING DISTRICTS AND MAP\n""} 
Sec. 23-1. Districts established. In order to regulate and limit the height and bulk of buildings hereafter erected or altered; to aid in implementing the City land use plan; to regulate and limit the density of dwelling units and population; to regulate and determine the area of yards and other open spaces; to regulate and restrict the location of trades and industries; and the location of buildings erected and altered for specific uses in accordance with the City land use plan, the City is hereby divided into the following classifications or districts: A-1, Agricultural district E-3, Agricultural estate district E-2, Rural estate district E-1, Estate district R-1-A, Single-family (12,500 s.f. lot) district R-1-B, Single-Family (8,000 s.f. lot) district R-1-C, Single-family (7,500 s.f. lot) district R-1-D, Single-family (6,000 s.f. lot) district TH-1, Townhouse district R-2, Duplex district R-3, Multi-family (low density) district R-4, Multi-family (moderate density) district OP, Office park district B-1, Planned neighborhood business district B-2, Planned community business center district B-3, General business district C-1, Service station district C-2, Vehicle service district I-1, Light industry district P-1, Park and recreational district M/I, Medical/Institutional district X-1, Civic district U-1, Public utilities district PRD, Planned residential development district PMUD, Planned mixed-use development district PCD, Planned commercial development district PID, Planned industrial development district SRL, Special residential lifestyle overlay district CS, Community Services district\n""} 
Sec. 23-2. Conversion of existing districts.Subdivision Name\n\t\t\t\t\t\t\t\t\t\t\t\tCurrent Zoning\n\t\t\t\t\t\t\t\t\t\t\t\tConsistent Zoning District Based on Setbacks & Lot Size\n\t\t\t\t\t\t\t\t\t\t\t\tSubdivision Name\n\t\t\t\t\t\t\t\t\t\t\t\tCurrent Zoning\n\t\t\t\t\t\t\t\t\t\t\t\tConsistent Zoning District Based on Setbacks & Lot Size\n\t\t\t\t\t\t\t\t\t\t\t\tCooper City Park\n\t\t\t\t\t\t\t\t\t\t\t\tR-1-A\n\t\t\t\t\t\t\t\t\t\t\t\tR-1-C\n\t\t\t\t\t\t\t\t\t\t\t\tCooper Colony Estates\n\t\t\t\t\t\t\t\t\t\t\t\tSection One\n\t\t\t\t\t\t\t\t\t\t\t\t\tR-1-A\n\t\t\t\t\t\t\t\t\t\t\t\tR-1-C\n\t\t\t\t\t\t\t\t\t\t\t\tSection Two\n\t\t\t\t\t\t\t\t\t\t\t\t\tR-1-A\n\t\t\t\t\t\t\t\t\t\t\t\tR-1-C\n\t\t\t\t\t\t\t\t\t\t\t\tSection Two A\n\t\t\t\t\t\t\t\t\t\t\t\t\tR-1-A & R-1-B \n\t\t\t\t\t\t\t\t\t\t\t\tR-1-C\n\t\t\t\t\t\t\t\t\t\t\t\tSection Two B\n\t\t\t\t\t\t\t\t\t\t\t\t\tR-1-A\n\t\t\t\t\t\t\t\t\t\t\t\tR-1-C\n\t\t\t\t\t\t\t\t\t\t\t\tSection Two C\n\t\t\t\t\t\t\t\t\t\t\t\t\tR-1-A\n\t\t\t\t\t\t\t\t\t\t\t\tR-1-C\n\t\t\t\t\t\t\t\t\t\t\t\tCooper Estates - Section\n\t\t\t\t\t\t\t\t\t\t\t\tOne & TwoR-1-B & R-1-CR-1-C Country Address\n\t\t\t\t\t\t\t\t\t\t\t\tR-1-B\n\t\t\t\t\t\t\t\t\t\t\t\tR-1-C\n\t\t\t\t\t\t\t\t\t\t\t\tCountry, The\n\t\t\t\t\t\t\t\t\t\t\t\tR-1-A\n\t\t\t\t\t\t\t\t\t\t\t\tR-1-C\n\t\t\t\t\t\t\t\t\t\t\t\tSec. 1 & 2\n\t\t\t\t\t\t\t\t\t\t\t\t\tR-1-A\n\t\t\t\t\t\t\t\t\t\t\t\tR-1-C\n\t\t\t\t\t\t\t\t\t\t\t\tCountry, III\n\t\t\t\t\t\t\t\t\t\t\t\t\tR-1-A\n\t\t\t\t\t\t\t\t\t\t\t\tR-1-C\n\t\t\t\t\t\t\t\t\t\t\t\tFlamingo Gardens\n\t\t\t\t\t\t\t\t\t\t\t\tR-1-A\n\t\t\t\t\t\t\t\t\t\t\t\tR-1-C\n\t\t\t\t\t\t\t\t\t\t\t\tBlack Olive, Jacaranda Live Oak, Poinciana Tamarind\n\t\t\t\t\t\t\t\t\t\t\t\t\tFlaming Gardens, Phase IIR-1-BR-1-CGateland EstatesR-1-AR-1-CGuardian EstatesR-1-AR-1-CPine LakeR-1-AR-1-CStirling SpringsR-1-AR-1-CTimberlake, 1st, 2nd, & 3rd additionsR-1-AR-1-C \n""} Subdivision Name\n\t\t\t\t\t\t\t\t\t\t\t\t Current Zoning\n\t\t\t\t\t\t\t\t\t\t\t\t Consistent Zoning District Based on Setbacks & Lot Size\n\t\t\t\t\t\t\t\t\t\t\t\t Subdivision Name\n\t\t\t\t\t\t\t\t\t\t\t\t Current Zoning\n\t\t\t\t\t\t\t\t\t\t\t\t Consistent Zoning District Based on Setbacks & Lot Size\n\t\t\t\t\t\t\t\t\t\t\t\t Cooper City Park\n\t\t\t\t\t\t\t\t\t\t\t\t R-1-A\n\t\t\t\t\t\t\t\t\t\t\t\t R-1-C\n\t\t\t\t\t\t\t\t\t\t\t\t Cooper Colony Estates\n\t\t\t\t\t\t\t\t\t\t\t\t Section One\n\t\t\t\t\t\t\t\t\t\t\t\t\t R-1-A\n\t\t\t\t\t\t\t\t\t\t\t\t R-1-C\n\t\t\t\t\t\t\t\t\t\t\t\t Section Two\n\t\t\t\t\t\t\t\t\t\t\t\t\t R-1-A\n\t\t\t\t\t\t\t\t\t\t\t\t R-1-C\n\t\t\t\t\t\t\t\t\t\t\t\t Section Two A\n\t\t\t\t\t\t\t\t\t\t\t\t\t R-1-A & R-1-B \n\t\t\t\t\t\t\t\t\t\t\t\t R-1-C\n\t\t\t\t\t\t\t\t\t\t\t\t Section Two B\n\t\t\t\t\t\t\t\t\t\t\t\t\t R-1-A\n\t\t\t\t\t\t\t\t\t\t\t\t R-1-C\n\t\t\t\t\t\t\t\t\t\t\t\t Section Two C\n\t\t\t\t\t\t\t\t\t\t\t\t\t R-1-A\n\t\t\t\t\t\t\t\t\t\t\t\t R-1-C\n\t\t\t\t\t\t\t\t\t\t\t\t Cooper Estates - Section\n\t\t\t\t\t\t\t\t\t\t\t\t One & Two R-1-B & R-1-C R-1-C Country Address\n\t\t\t\t\t\t\t\t\t\t\t\t R-1-B\n\t\t\t\t\t\t\t\t\t\t\t\t R-1-C\n\t\t\t\t\t\t\t\t\t\t\t\t Country, The\n\t\t\t\t\t\t\t\t\t\t\t\t R-1-A\n\t\t\t\t\t\t\t\t\t\t\t\t R-1-C\n\t\t\t\t\t\t\t\t\t\t\t\t Sec. 1 & 2\n\t\t\t\t\t\t\t\t\t\t\t\t\t R-1-A\n\t\t\t\t\t\t\t\t\t\t\t\t R-1-C\n\t\t\t\t\t\t\t\t\t\t\t\t Country, III\n\t\t\t\t\t\t\t\t\t\t\t\t\t R-1-A\n\t\t\t\t\t\t\t\t\t\t\t\t R-1-C\n\t\t\t\t\t\t\t\t\t\t\t\t Flamingo Gardens\n\t\t\t\t\t\t\t\t\t\t\t\t R-1-A\n\t\t\t\t\t\t\t\t\t\t\t\t R-1-C\n\t\t\t\t\t\t\t\t\t\t\t\t Black Olive, Jacaranda Live Oak, Poinciana Tamarind\n\t\t\t\t\t\t\t\t\t\t\t\t\t Flaming Gardens, Phase II R-1-B R-1-C Gateland Estates R-1-A R-1-C Guardian Estates R-1-A R-1-C Pine Lake R-1-A R-1-C Stirling Springs R-1-A R-1-C Timberlake, 1st, 2nd, & 3rd additions R-1-A R-1-C
Sec. 23-3. Zoning map established. (a) The districts aforesaid and the boundaries of such districts as shown on the zoning map, which is on file in the office of the city clerk and designated as the zoning map of the city, are hereby adopted and made a part of this chapter. The zoning map and all notations, references, and other information shown thereon shall be as much a part of this chapter as if such matters and information set forth on the map were all fully described and set out thereon. (b) If, because of error or omission in the zoning map, any property in the city or that has been annexed into the city is not shown as being in a zoning district, the classification of such property shall be A-1, unless the A-1 district is not permitted according to the comprehensive plan, in which case compatible zoning will be enacted by amendment to this chapter.\n""} 
Sec. 23-4. Interpretation of district boundaries. Where uncertainty exists as to boundaries of any district shown on the official zoning map, the following rules shall apply: (a) Where such district boundaries are indicated as approximately following street lines, alley lines, lot lines, or land use plan lines, such lines shall be construed to be boundaries. (b) In unsubdivided property, or where a district boundary divides a lot, the location of such boundary, unless the same is indicated by dimensions, shall be determined by the use of the scale appearing on the map. (c) Where any street or alley is hereafter officially vacated or abandoned, the regulations applicable to each parcel of abutting property shall apply to that portion of such street or alley added thereto by virtue of such vacation or abandonment. (d) Where a district boundary line divides a lot in a single ownership on April 2, 1962, the city commission may, in its discretion, permit a use authorized in either portion of such lot to extend to the entire lot.\n""} 
Sec. 23-5. Supplemental nature of district regulations. The provisions of this chapter shall be supplemental and not in lieu of all existing ordinances and regulations existing in the city, as specifically, the provisions of the official charter of the city.\n""} 
Sec. 23-6--23-7. Reserved.\n""} 
Sec. 23-8. Applicability.\n""} 
ARTICLE II. USE REGULATIONS No building shall be erected, reconstructed, or structurally altered, nor shall any building or land be used for any purpose other than as permitted herein by the district in which such building or land use is located. If there is a conflict between the land uses designated by this chapter and the city comprehensive land use plan, the regulations included in the land use plan shall prevail.\n""} 
Sec. 23-9. Use classification. The use regulations of the zoning districts are based on the following use classification system. (a) Purpose and intent. The purpose of these provisions is to classify uses of land into a number of specially defined land use categories on the basis of common functional characteristics and similar compatibility with other uses, thereby providing a basis for regulation of uses in accordance with criteria that are directly relevant to the public interest. These provisions shall apply throughout this chapter. (b) Classification of principal uses. The use categories listed on the following use regulations schedule shall be considered to be principal uses. A single lot may contain more than one principal use, unless otherwise prohibited by the provisions of this chapter. All existing and proposed uses shall be classified into the use category that most closely portrays the overall nature of such activity, consistent with the definitions of the use categories in sec. 21-9, definitions. Any use that cannot be so classified shall not be permitted in any district.\n""} ",11,codelibrary
31,Idaho,Canyon County,MIDDLETON,"ShareDownloadBookmarkPrint5-1-4: ZONING DISTRICTS ESTABLISHED: A. Districts Established: For the purpose of promoting health, safety, and general welfare, the City hereby adopts the following zoning districts:A-RAgricultural ResidentialC-1Neighborhood CommercialC-2Light CommercialC-3Heavy CommercialM-1Light IndustrialM-2Heavy IndustrialR-1Estate ResidentialR-2Large Lot ResidentialR-3Single-Family ResidentialRRRRestaurant, Retail and RecreationTODTransit-Oriented DevelopmentM-FMultiple-Family ResidentialM-UMixed Use B. Boundaries Established: The boundaries of the use districts shall be established and clearly indicated upon the zoning map adopted and amended by the City Council. C. Boundary Interpretation: Whenever any uncertainty exists as to the boundary of any district shown on the zoning map, the following rules shall apply: 1. Where any such boundary line is indicated as following a road, alley or public way, it shall be construed as following the centerline thereof. 2. Where a boundary line is indicated as approximately following a lot line, such lot line shall be construed to be such boundary line. (Ord. 600, 12-20-2017; amd. Ord. 609, 7-3-2018)",1,codelibrary
33,Illinois,Cook County,WESTERN SPRINGS,"CHAPTER 5ZONING DISTRICTSSECTION:10-5-1: Establishment Of Zoning Districts10-5-2: Purpose Statements10-5-3: Zoning Map10-5-4: Annexed Lands 
10-5-1: ESTABLISHMENT OF ZONING DISTRICTS:For the purposes of this ordinance, the village of Western Springs is hereby divided into the following zoning districts: A. Residence Districts:A - Single-family residence districtR1 - Single-family residence districtR2 - Single-family residence districtR3 - Two-family residence districtR4 - Multiple-family residence districtRB - Residential buffer districtSFA - Single-family attached residence districtR5 - Continuing care retirement community residence district B. Business Districts:C1 - Village center commercial districtC2 - Community shopping districtO - Limited office districtORI - Office research and limited industrial districtDT - Downtown transitional districtMXD - Mixed use commercial-residential district C. Special Purpose Districts:MGL - Municipal and governmental land district(Ord. 01-2158, 1-22-2001; amd. Ord. 03-2266, 10-27-2003; Ord. 04-2308, 9-13-2004; Ord. 09-2552, 10-12-2009; Ord. 15-2786, 2-23-2015)\n""} 
10-5-2: PURPOSE STATEMENTS: A. Residence Districts: 1. A - Single-Family Residence District: This district is intended to provide a residential environment of larger lots with generous yards. It also establishes the standards for new single-family developments in the community. 2. R1 - Single-Family Residence District: This district is intended to provide a residential environment of moderate sized lots which still provide for generous yards. 3. R2 - Single-Family Residence District: This district is intended to provide a residential environment of moderate sized lots with smaller yards. 4. R3 - Two-Family Residence District: This district is intended to provide a residential environment for two-family dwellings and shall be located on the fringe of single-family neighborhoods along arterial and collector streets or adjacent to the downtown area. \""Two-family units\"" may be defined either as side by side units separated by a common wall or stacked units with one unit on top of the other. 5. RB - Residential Buffer District: This district is established to provide for a mix of low density single-family and two-family uses and low density office uses which are designed as traditional, detached residential styled buildings or structures. The district shall serve as a transitional zone, which is an area, used to gradually decrease the intensity of use and to develop distance between single-family residentially zoned property and more intensive land uses and zoning districts, such as commercially zoned property. The district may or may not be appropriate in, and shall be limited to, the following locations: a. Corner lots located adjacent to and at the intersection of regional arterial streets where property zoned for residential purposes is abutted by, or across the street from, any commercial, industrial or office district; and/or b. Lots located adjacent to the C1 - village center commercial district. 6. R4 - Multi-Family Residence District: This district is intended to provide for a multiple-family residential environment of moderate density. The R4 district is intended to accommodate existing apartment buildings which have developed over time within the village. While this district will be applied to existing multi-family development built on a lot by lot basis, it is intended that new multi-family dwelling units shall be constructed as part of a planned development. (Ord. 01-2158, 1-22-2001) 7. SFA - Single-Family Attached Residence District: This district is intended to provide a residential environment for two-family and single-family attached dwellings and shall be located adjacent to the BNSF Railroad right of way east and west of the downtown area. (Ord. 03-2266, 10-27-2003) 8. R5 - Continuing Care Retirement Community Residence District: This district is intended to provide for the development of larger tracts of land that are not less than twenty (20.0) gross acres in size nor in excess of forty (40.0) gross acres in size. The intent is for such land to be developed as a continuing care retirement community (\""CCRC\"") under the village's planned development and conditional use regulations. A CCRC is a planned residential development intended for individuals sixty two (62) years of age or older or couples at least one member of which is sixty two (62) years of age or older which shall include a licensed nursing home facility as an integral part of the development and also provide facilities for varying degrees of assisted living for residents and other such accessory uses that may be appropriate for a CCRC and each of these other facilities, to the extent required by law, shall be licensed, operated and maintained in accordance with the laws and regulations of the state of Illinois. (Ord. 04-2308, 9-13-2004) B. Business Districts: 1. C1 - Village Center Commercial District: This district constitutes the town center or downtown of Western Springs and is intended to accommodate a range of compatible retail, financial, service, governmental, professional and residential uses in a setting conducive to and safe for pedestrian activity. This district is intended principally for retail commercial uses. 2. C2 - Community Shopping District: This district is intended to provide for those commercial activities that require locations along arterial or collector streets with larger lots and greater vehicular access. 3. O - Limited Office District: This district is intended to provide an environment for small office facilities that generate minimal vehicular traffic and require little visibility from the streets on which they are located. It is intended that this district be located principally to function as a buffer between commercial and residential districts. This district must be located adjacent to a commercial district. A single residential dwelling is permitted above the first floor. 4. ORI - Office Research And Limited Industrial District: This district is intended to provide an environment for light industrial uses that do not produce noise, vibration, smoke, particulate matter, fire and explosive hazards, toxic matter, odorous matter, and/or glare, or otherwise create nuisances which could impact nearby residential development. (Ord. 92-1855, 12-14-1992) 5. DT - Downtown Transitional District: This district is intended to provide a transitional zone used to gradually decrease the intensity of use and to separate single-family residentially zoned property and commercially zoned property. It provides a location for surface parking lots and potentially other compatible land uses adjacent to and serving commercial uses within the C1 - village center commercial district. (Ord. 03-2266, 10-27-2003) 6. MXD - Mixed Use Commercial-Residential District: This district is intended to provide opportunities for development of sites with new or rehabilitated buildings that contain a mix of commercial and residential uses. The first floor of such buildings should provide space for commercial, office, retail and service uses that are easily accessible to the public. First floor residential uses are permitted but should be located in areas that are secondary to the commercial spaces. The first floor of the building also should include other related ancillary services and amenities that support the building occupants, such as internal pedestrian accessways and elevator areas, storage areas, concierge or security desk, mechanical and utility rooms, restrooms, meeting rooms and common areas that serve some or all of the building uses. The properties that are eligible to be rezoned to this district are located at the southeast corner of the Burlington Avenue and Wolf Road intersection and are identified as: property index numbers 18-05-305-011, 18-05-305-028 and 18-05-305-029 (formerly the Tischler's Grocery Store site and the Breen's Drycleaner Store site); property index numbers 18-05-305-009, 18-05-305-010 and 18-05-305-023 (the Benak Auto Repair Shop site); and property index numbers: 18-05-305-026 (the Commonwealth Edison site) (see also, plan commission recommendation no. 15-01). (Ord. 15-2786, 2-23-2015) C. Special Purpose Districts: 1. Municipal And Governmental Land District: This district is intended to accommodate and regulate the use and development of land owned by the village and state, county and federal governments within the jurisdictional boundaries of the village. (Ord. 09-2552, 10-12-2009)\n""} 
10-5-3: ZONING MAP: A. Location And Boundaries: The location and boundaries of the districts established by this ordinance are set forth in the official zoning map as amended from time to time, which is incorporated herein and hereby made a part of this ordinance. The map shall be published as provided by law as a part of this ordinance, as though fully set forth and described herein. The map shall be filed with the office of the village clerk and certified copies shall be made available for public purchase and inspection from the village clerk's office during standard business hours. B. Zoning Map Interpretation: 1. Zoning district boundary lines shall be interpreted to be coterminous with centerlines of streets, alleys, expressways and railroad rights of way; section lines or division of section lines; tract or lot lines; and such lines extended, unless otherwise indicated. 2. In areas not subdivided into lots and blocks, wherever a district or portion of a district is indicated as a strip adjacent to and paralleling a street, highway, or railroad, the depth of such strips shall be in accordance with dimensions shown on the maps measured at right angles from the centerline of streets, highways, or railroad rights of way unless otherwise indicated. (Ord. 92-1855, 12-14-1992)\n""} 
10-5-4: ANNEXED LANDS:On all land annexed to the village of Western Springs after the effective date hereof, no construction or modification of land use shall occur until an ordinance designating the zoning classification of such land is duly adopted by the village of Western Springs. Within thirty (30) days of annexation, the plan commission shall file an application for an amendment to establish the zoning classification of such land. Action shall be taken by the Western Springs village board on such application within sixty (60) days of its filing. If no preannexation hearing is held and the Western Springs village board does not approve a zoning amendment to classify such land as provided for in this ordinance, such land will be classified as A - single-family residence district, until such time as an amendment changing the zoning classification is adopted. (Ord. 92-1855, 12-14-1992)\n""} ",5,codelibrary
34,Illinois,DuPage County,BARTLETT,"ShareDownloadBookmarkPrint10-4-1: DISTRICTS ESTABLISHED:In order to carry out the purposes and provisions of this comprehensive amendment, the Village is hereby divided into the following districts: A. Residential Districts:ER-1Estate Residence (80,000 square feet and above)ER-2Estate Residence (40,000 square feet to 79,999 square feet)ER-3Estate Residence (20,000 square feet to 39,999 square feet)SR-2Suburban Residence (10,800 square feet to 19,999 square feet)SR-3Suburban Residence (8,100 square feet to 10,799 square feet)SR-4Suburban Residence (6,000 square feet to 8,099 square feet)SR-5Low Density Multiple-Family ResidenceSR-6Medium Density Multiple-Family ResidenceMH-1Restricted Mobile Home B. Office, Commercial, And Industrial Districts: OROffice/ResearchB-1Village CenterB-2Local Convenience ShoppingB-3Neighborhood ShoppingB-4Community ShoppingI-1Light IndustrialI-2EDA Economic Development Area C. Special Districts: P-1Public LandW-BWest Bartlett Road Corridor OverlayPDPlanned DevelopmentDT-ODowntown Overlay (Ord. 2013-45, 6-4-2013; amd. Ord. 2019-95, 11-19-2019)",1,codelibrary
35,Illinois,DuPage County,HINSDALE,ShareDownloadBookmarkPrintARTICLE II. ZONING DISTRICTS AND OFFICIAL ZONING MAPSECTION:2-101: Establishment Of Zoning Districts2-102: Interpretation Of District Sequence2-103: Zoning Map2-104: Annexed Land ,1,codelibrary
