idx,state,county,muni,all_text,section_count,source
86,Michigan,Kent County,EAST GRAND RAPIDS,ShareDownloadBookmarkPrintARTICLE III. ZONING DISTRICTS AND MAP,1,codelibrary
94,Michigan,Wayne County,GARDEN CITY,"ShareDownloadBookmarkPrint 154.195 CREATION OF DISTRICTS. For the purposes of this chapter, the city is divided into the following Zoning Districts as shown on the Official Zoning map. R-1 One-Family Residential District R-2 Two-Family Residential District R-3 Multiple-Family Residential District O-1 Office District C-1 Local Business District C-2 Community Business District C-3 General Business District CBD Central Business District M-1 Light Industrial District PD Planned Development District VP Vehicular Parking District PR Public Recreation District(Ord. 92-005, passed 2-17-92) ",1,codelibrary
98,Minnesota,Dakota County,FARMINGTON,"ShareDownloadBookmarkPrint10-5-2: ZONING DISTRICTS:The city is divided into the following base and overlay districts shown by the district boundaries on the zoning map. The base districts are:A-1 AgricultureR-1 Low density residentialR-2 Low/medium density residentialR-3 Medium density residentialR-4 High density residentialR-D Downtown residentialB-1 Highway businessB-2 Downtown businessB-3 General businessSSMU Spruce Street mixed-useMUCI Mixed use commercial/industrialMUCR Mixed use commercial/residentialI Industrial P/OS Parks and open space The overlay districts are: PUD Planned unit development overlayFloodplain overlayDC-O Downtown commercial overlayHW3-O Highway 3 overlaySS-O Spruce Street overlay (Ord. 002-469, 2-19-2002; amd. Ord. 002-472, 5-6-2002; Ord. 003-498, 9-15-2003; Ord. 005-526, 3-21-2005; Ord. 009-613, 10-19-2009; Ord. 009-614, 10-19-2009; Ord. 021-761, 8-16-2021)",1,codelibrary
102,Missouri,St. Charles County,COTTLEVILLE,ecode_360_nothing_found,-1,ecode360
103,Missouri,St. Charles County,O'FALLON,ecode_360_nothing_found,-1,ecode360
104,Missouri,St. Charles County,ST. PETERS,ecode_360_nothing_found,-1,ecode360
106,New Jersey,Atlantic County,NORTHFIELD,ecode_360_nothing_found,-1,ecode360
110,Ohio,Cuyahoga County,BROOK PARK,"ShareDownloadBookmarkPrint1121.03 DIVISION INTO DISTRICTS; MAP INCORPORATED; COMPLIANCE REQUIRED. (a) For the purpose of this Zoning Ordinance, the City of Brook Park is hereby divided into nine classes of Use Districts, termed respectively Class U-1, U-2, U-3, U-3A, U-3B, U-3C, U-3D, U-4 and U-5; also, into three classes of Height Districts, termed respectively Class H-1, H-2 and H-3; and also into six classes of Area Districts, termed respectively Class A-1, A-2, A-3, A-4, A-5 and A-6, all as shown on the Zone Map of the City on file with the Clerk, and which accompanies this Zoning Ordinance and is hereby made a part thereof. (Ord. 2214-1962. Passed 5-1-62; Ord. 2710-1967. Passed 11-21-67; Ord. 2783A-1967. Passed 11-10-67; Ord. 4394-1973. Passed 6-25-73; Ord. 4771-1975. Passed 7-14-75.) (b) The Use, Height and Area Districts designated on the Zone Map are hereby established. The Map designations and the Map designation rules which accompany the Map are hereby declared to be part thereof and hereof. (c) No building or premises shall be erected or used except in conformity with the regulations herein prescribed for the respective Use, Height and Area District in which such building or premises is located. (Ord. 1735-1957. Passed 12-3-57.) ",1,codelibrary
111,Ohio,Cuyahoga County,HIGHLAND HEIGHTS," 						 						 						 						 						 						 						 						 						 						 						 						 						 						 						 						 						 						 						 						 						 						 						 						 						 						 						 						 						 						 						 						 						 						 						 						 						 						 						CHAPTER 1121Districts Established; Map1121.01 Districts established. 1121.02 Zone Map.1121.03 District boundary lines.1121.04 Regulations applying to all districts.CROSS REFERENCES Voter approval required on amendments - see CHTR. 8.02.02(4) Basis of districts - see Ohio R.C. 713.10 Map amendment conditions - see P. & Z. 1115.01 Map changes listed - see P. & Z. Appendix
 1121.01 DISTRICTS ESTABLISHED. For the purpose of this Zoning Code and the Zone Map herein adopted, the City is hereby divided into the following districts: RESIDENTIAL DISTRICTS TitleAbbreviationOne-Family U-1Two-FamilyU-2Multi-Family U-3BUSINESS AND MANUFACTURING DISTRICTS Automobile Parking POffice BuildingO-BLocal BusinessL-BMotor ServiceM-SGeneral Business G-BPark-Commercial-Light Manufacturing P-C-M RECREATION AND RESIDENTIAL DEVELOPMENT DISTRICT Council hereby ordains that such districts within the City shall be as are set forth on the Zone Map. Whenever the abbreviated terms, U-1, U-2, etc., are used in this Zoning Code, they shall be construed as referring to their corresponding district titles. Buildings and land shall be used only for the uses specifically set forth in this Zoning Code as permitted in the district and not for uses enumerated in any other use classification of this Zoning Code, unless such uses are specifically permitted in this Zoning Code. (Ord. 8-1973. Passed 4-24-73.) \n""} Title Abbreviation One-Family U-1 Two-Family U-2 Multi-Family U-3 Automobile Parking P Office Building O-B Local Business L-B Motor Service M-S General Business G-B Park-Commercial-Light Manufacturing P-C-M 
 1121.02 ZONE MAP. The districts listed in Section 1121.01 are designated by symbols, with the boundaries of such districts established on a map entitled \""Zone Map of Highland Heights, Ohio\"", dated July 9, 1963. The Zone Map, including all notations, references, data and other information shown thereon, is hereby made a part of this Zoning Code, and may be amended in the same manner as any other part of the Zoning Code. (Ord. 21-1963. Passed 7-9-63.) \n""} 
 1121.03 DISTRICT BOUNDARY LINES. The district boundary lines are intended to follow the center lines of streets, alleys, lot lines or their extensions. Where a boundary line obviously does not coincide with any of the aforesaid lines, and where it is not located by dimensions shown on the Zone Map, it shall be determined by use of the scale appearing thereon. Any errors which may occur in the determination of such district boundary lines shall become the subject of amendment to this Zoning Code. (Ord. 21-1963. Passed 7-9-63.)\n""} 
1121.04 REGULATIONS APPLYING TO ALL DISTRICTS. The cultivation, processing or retail dispensing of marijuana for medical purposes is prohibited in all zoning districts of the City of Highland Heights.(Ord. 2-2017. Passed 2-28-17.)\n""} ",5,codelibrary
113,Ohio,Hamilton County,SPRINGFIELD,"TITLE TWO - Uses Permitted by DistrictChap. 1105 A Agricultural District.Chap. 1106 RR-1 Rural Residence District.Chap. 1107 RS-5 Low-Density, Single Family Residence District.Chap. 1108 RS-8 Medium-Density, Single-Family Residence District.Chap. 1109 RFBH Factory-Built Housing Residence District.Chap. 1111 RM-12 Low-Density, Multi-Family Residence District.Chap. 1112 RM-20 Medium-Density, Multi-Family Residence District.Chap. 1113 CN-2 Neighborhood Commercial District.Chap. 1114 RM-44 High-Density, Multi-Family Residence District.Chap. 1115 RM-44A High-Density, Multi-Use District.Chap. 1116 CO-1 Commercial Office District.Chap. 1117 CN-1 Neighborhood Commercial District.Chap. 1118 CC-2 Community Commercial District.Chap. 1119 EC-1 Educational Campus District.Chap. 1120 CB-10 Central Business District.Chap. 1121 CH-1 Highway Commercial District.Chap. 1122 CI-1 Intensive Commercial District.Chap. 1123 RDP Research and Development Park District.Chap. 1124 M-1 General Manufacturing District.Chap. 1125 M-2 Heavy Manufacturing District.Chap. 1126 G Green Space, Park and School District.Chap. 1127 OFP Flood Plain Overlay District.Chap. 1128 OHP Historic Preservation Overlay District.Chap. 1129 OPD-H Planned Development Housing Overlay District.Chap. 1130 CC-2A Shopping Center District.Chap. 1131 UCOD Urban Commercial Overlay District.Chap. 1132 UCED Urban Commercial Entryway Overlay District.Chap. 1133 DMC Downtown Medical Campus District.Chap. 1135 Requirements for Specific Uses.Chap. 1140 PD Planned Development District.Chap. 1141. UPOD Unified Plan Overlay District.Chap. 1142. EECPOD Eastern Edge Corridor Plan Overlay District. ",1,codelibrary
114,Ohio,Lake County,MENTOR,"ShareDownloadBookmarkPrint1153.01 DISTRICTS ESTABLISHED. (a) The City is hereby divided into the following zones or districts:R-1 Single Family ResidentialR-2 Single Family ResidentialR-3 Single Family ResidentialR-4 Single Family ResidentialR-5 Estate ZoningR-10 Multi-Family ResidentialRMH Mobile HomeC-1 ConservationC-2 Commercial RecreationOV Old Village DistrictB-1 Community ServiceB-2 General BusinessB-3 Interchange Service DistrictPUD Planned Unit DevelopmentM-1 Light ManufacturingM-2 Heavy ManufacturingMRD Research & DevelopmentMIP Industrial Park (b) Land may also be classified in the following special districts: FH Flood Hazard(1969 Code 150.101; Ord. 07-0-42. Passed 4-17-07; Ord. 20-0-062. Passed 8-18-20.) (c) Old Village (OV) District. (1) Purpose and intent. The purpose of the Old Village District (OV), hereinafter sometimes referred to as the Old Village, is to: A. Preserve, stabilize, restore and enhance pedestrian-oriented small- scale commercial and residential neighborhoods and to provide through mixed-use development only for those commercial activities which are compatible with a neighborhood of this character; B. Protect the unique historic and architectural character of the Old Village and to ensure historic preservation in the district; C. Strengthen the economy of the City through the preservation and creation of jobs; D. Increase the City s tax base by encouraging reinvestment in historic buildings and redevelopment within the Old Village; E. Further implement the City s Comprehensive Plan. The goal of preservation and redevelopment within the Old Village is to create a vibrant residential, office, and retail district in the heart of the City benefiting property owners, residents, and visitors in particular and all citizens in general, economically, socially, and culturally. (2) Permitted and conditionally permitted uses. A. Residential: 1. Single, duplex and multi-family residential dwellings of at least 1,200 square feet per dwelling unit. Accessory uses customarily incidental to residential use. 2. Live/work units only upon issuance of a conditional use permit. 3. Independent and semi-independent residential facilities only upon issuance of a conditional use permit. 4. Home occupations only upon issuance of a conditional use permit. B. Medical: 1. Offices of licensed medical professionals. 2. Hospitals, medical clinics and treatment centers, rehabilitation centers and facilities, nursing, assisted living, group care and other similar skilled care facilities and/or homes all only upon issuance of a conditional use permit. C. Education and Recreational: 1. Public schools, private schools, and any substantially similar educational facilities all only upon issuance of a conditional use permit. 2. Sports, recreation, fitness, training and any similar physical activity facilities and/or establishments all only upon issuance of a conditional use permit. 3. Theater, concert, assembly and meeting halls, houses of worship, and any such similar group meeting venues all only upon issuance of a conditional use permit. 4. Library, museum, and public facilities all only upon issuance of a conditional use permit. D. Office, Retail and Services: 1. Child and adult day care centers only upon issuance of a conditional use permit. 2. Offices of professional service providers in the fields of banking, finance and financial services, accounting, taxation, insurance, real estate, architecture, engineering, information technologies, and law. Offices of other substantially similar professional service providers only upon issuance of a conditional use permit. Drive-through and ATM facilities associated with one of these uses may be permitted only upon issuance of a conditional use permit. 3. Traditional retail establishments not in excess of 15,000 square feet of gross leasable space except only upon issuance of a conditional use permit. Drive-through facilities associated with one of these uses may be permitted only upon issuance of a conditional use permit. 4. Food and/or beverage preparation and/or service establishments only upon issuance of a conditional use permit. 5. Barber, hair style, beauty, spa, and any similar grooming, hygiene and beauty care establishments all only upon issuance of a conditional use permit. 6. Hotel, inn, bed-and-breakfast and any similar places of overnight accommodation all only upon issuance of a conditional use permit. 7. Laundromats and/or dry cleaners only upon issuance of a conditional use permit. 8. Funeral home only upon issuance of a conditional use permit. Crematories, regardless of whether the crematory is the principal or an ancillary use, are neither permitted as of right nor conditionally permitted. 9. Art galleries, artisan and photographic studios. (3) Prohibited uses. The following uses are prohibited within the OV District: A. Sexually-oriented businesses. B. Tattoo and/or body piercing establishments. C. Massage parlors. The offices of duly licensed massotherapists are not included in this prohibition. D. Drive-through facilities unless express provision is made for the issuance of a conditional use permit for the specified use. Prohibited uses are enumerated herein solely to avoid potential confusion in interpretation with those uses which are permitted and conditionally permitted within the OV District. This enumeration of prohibited uses is not to be interpreted as either expressly or impliedly permitting any uses other than those which are expressly permitted or conditionally permitted by the district regulations.The Board of Building and Zoning Appeals shall have no jurisdiction to grant variances from these prohibitions. (4) Minimum area and width. Established by development plan. (5) Minimum setbacks. Established by development plan. (6) Maximum height. 30 feet or higher based upon approved development plan. (7) Minimum floor area. All residential dwelling units: 1,200 square feet per dwelling unit All non-residential uses: None (8) Maximum dwelling units per acre. 8 (9) Criteria for lands zoned Old Village District (OV). A. Parcels shall be within or immediately adjacent those areas designated within the City s Comprehensive Plan as the Old Village Commercial Corridor. B. No re-zoning to OV may occur, whether by referendum or otherwise, unless and until a site development plan which is in accord with all pertinent requirements of the Code first receives Planning Commission and Council approval. C. The approved site development plan shall delineate the specific areas of the parcel, as well as structures and all parts thereof, which will be devoted to specified uses. Thereafter no change in use nor expansion of a use outside of the area, structure, or part thereof as so delineated may occur unless and until application is made to modify the approved development plan to permit such a change and approval is obtained in accordance with all requirements of this Code. D. No parcel, or portion thereof, zoned for residential use may as a consequence of re-zoning to OV thereafter be used for any non- residential uses unless the approved site development plan adopted at the time of re-zoning allows for non-residential use. This prohibition does not apply to live/work units or home occupations which have obtained a conditional use permit. The residential lands and this restriction on use shall be delineated as such on the Official Zoning Maps and plats and deeds that are filed of record. The Board of Building and Zoning Appeals shall have no jurisdiction to grant variances from this prohibition. E. Historic and/or architecturally significant structures, as defined by the OV supplemental regulations, must be preserved in accord with the regulations promulgated therefor and incorporated into any site development. F. Any new or re-development shall incorporate a mix of permitted uses. Emphasis may be placed on one particular type of use provided that the site and the structures thereon are designed to allow for flexibility and the ready adaptation to re-use of the site and structures for other uses permitted within the district without the need for substantial investment, alteration, or other changes either with the site or any structures thereon. A historic structure which is not conducive to mixed use as a consequence of its design and/or age may be used solely for one class of use. G. Site development, architectural design, and landscaping shall be in strict accord with the Design Guidelines for Commercial and Industrial Corridors - Village Core and any codified supplemental regulations for the OV district. All elevations of a structure shall receive uniform architectural design treatment. H. Site development within the OV District shall comply with the requirements all pertinent sections of this Zoning Code. The supplemental regulations for the OV District shall prevail in the event of any actual or apparent conflict between those regulations and any regulations contained elsewhere in this Code and without regard to whether the actual or apparent conflict is caused directly by the language used within the different Code sections or indirectly as a consequence of omission. I. The area of impervious coverage shall be no more than seventy-five percent (75%) of the total gross area. J. Provision shall be made in all site developments for non-vehicular circulation systems, including but not necessarily limited to sidewalks, pathways, and bikeways. To the maximum extent feasible, provision shall be made in the site development for interconnections with existing or planned streets and pedestrian or bikeway systems on adjoining properties. (Ord. 06-0-105. Passed 9-5-06; Ord.08-0-31. Passed 4-1-08.)",1,codelibrary
115,Ohio,Lake County,WICKLIFFE,"ShareDownloadBookmarkPrint 1305.10 ESTABLISHMENT OF DISTRICTS. In order to carry out the purposes of this Zoning Ordinance, the City of Wickliffe, Ohio, is hereby divided into the following districts: TitleAbbreviationPublic Open Space OSPrivate Recreation/Institutional INSResidential Districts One-family 100 R1-100One-family 75R1-75One-family 60 R1-60One-family 50 R1-50Two-family R2FMulti-familyRMFSenior /Adult ResidentialS/ABusiness Districts Office BuildingOBGeneral Business GBTown CenterTCCommercial and Industrial Commercial-ManufacturingCMIndustrialIWhenever the abbreviated terms OS, R1-75, OB, etc., are used in this Zoning Ordinance, they shall be construed as referring to the corresponding district titles. (Ord. 2003-34. Passed 6-23-03.)",1,codelibrary
116,Ohio,Lorain County,AMHERST,"ShareDownloadBookmarkPrint 1127.01 ESTABLISHMENT AND PURPOSE OF DISTRICTS. In order to classify, regulate and restrict the location of trades, industries, residences and other land uses and the height of buildings designed for special uses, to regulate and limit the height, bulk, number of stories and size of buildings and other structures hereafter erected or altered, to regulate the percentage of lot area which may be occupied, building lines, size of yards, courts and open spaces and the density of population, the City is hereby divided into eight classes of districts. All such regulations are uniform for each class or kind of building or structure or use throughout each class of districts and shall be known as: R-1 Single-Family Residence District; R-2 Two-Family Residence District; R-3 Multiple-Family Residence District; C-1 Commercial or Local Business District; C-2 Commercial or General Business District; C-3 Motor Service District and I-1 Industrial District. The districts and their boundary lines are indicated upon the Zoning Map of the City. Such Map, together with all notations and all other references thereon, are hereby made a part of this Zoning Code. Whenever any street or public way is vacated by official action of Council, the district adjoining each side of the street or way shall be automatically extended to the center of such vacation and all areas included in the vacation shall thereafter be subject to all regulations of the extended districts. (Ord. 65-82. Passed 12-27-65; Ord. 72-23. Passed 6-12-72.) ",1,codelibrary
117,Ohio,Lorain County,NORTH RIDGEVILLE,"ShareDownloadBookmarkPrint1248.01 ESTABLISHMENT OF DISTRICTS. For purposes of this Zoning Code, the City is hereby divided into the following zoning districts: R-1 Residence District R-2 Multiple Residence District R-3 Multiple Family Residence District R-4 Multiple Family Residence District R-5 Estate Residence District RS-1 Special Residence District RS-2 General Residence District B-1 Neighborhood Business District B-2 Central Business District B-3 Highway Commercial District B-4 Commercial Parkway District B-5 Architectural Business District I-1 Industrial Park District I-2 Light Industrial District I-3 Heavy Industrial District PCD Planned Community Development District SDD Special Development District(Ord. 2748-93. Passed 4-19-93; Ord. 2827-94. Passed 2-22-94; Ord. 3491-99. Passed 9-20-99; Ord. 3993-2004. Passed 1-20-04.) ",1,codelibrary
118,Ohio,Butler County,FAIRFIELD,"ShareDownloadBookmarkPrint1141.01 DIVISION OF CITY INTO DISTRICTS. For the purpose of the Zoning Ordinance, the City is hereby divided into eighteen categories of Zoning Districts as follows:(a) Agricultural - Residential Districts.(1) A-1 Agricultural and Estate District.(2) R-0 One-Family Residence District.(3) R-1 One-Family Residence District.(4) R-2 One to Four Family Residence District.(5) R-3 Multi-Family Residence District.(6) R-4 Low Density Multi-Family Residence District.(b) Non-Residential Districts.(1) B-1 Institutions and Office District.(2) C-4 Commercial Transition District.(3) C-1 Neighborhood Business District.(4) C-2 Central Business District.(5) C-2A Central Business District - Modified.(6) C-2B Central Business District - Modified.(7) C-3 General Business District.(8) C-3A General Business District - Modified.(9) M-1 Industrial Park District.(10) M-1A Industrial Park District - Modified.(11) M-2 General Industrial District.(12) M-2A General Industrial District - Modified.(Ord. 94-84. Passed 7-9-84.)",1,codelibrary
119,Ohio,Cuyahoga County,SOUTH EUCLID,"ShareDownloadBookmarkPrint712.01 ESTABLISHMENT OF DISTRICTS. In order to carry out the purposes and regulations of this Planning and Zoning Code, the following zoning districts are hereby established: RESIDENTIAL DISTRICTS Title Abbreviation One-Family District R-75 One- and Two-Family District R-60 One- and Two-Family District R-50 One- and Two-Family District R-40 Multiple-Family District M-F COMMERCIAL DISTRICTS Residence-Office District R-O Limited Commercial District C-1 General Commercial District C-2 Special Commercial District C-3 MANUFACTURING DISTRICTS Limited Manufacturing District M-1 General Manufacturing District M-2 ",1,codelibrary
